{
  "_comment": "kb-document instance for scn_vendor_doc_en",
  "id": "doc_b1c2d3e4",
  "source_path": "examples/scn_vendor_doc_en/kb/sop_vpn_en.md",
  "source_url": null,
  "title": "VPN Troubleshooting SOP (English)",
  "classification": "internal",
  "content_hash": "sha256:b1c2d3e4000000000000000000000000000000000000000000000000000000000000",
  "version": "1.0.0",
  "ingested_at": "2026-05-06T00:00:00Z",
  "last_modified": "2026-01-01T00:00:00Z",
  "language": "en",
  "tags": ["vpn", "sop", "ipsec", "ikev2", "vendor", "en"],
  "namespace": "opspilot:public-kb",
  "chunk_strategy": "headings_then_size",
  "chunk_count": 3,
  "embedding_model": "ollama-local/nomic-embed-text-v2-moe@2026-04",
  "embedding_dim": 768,
  "redaction_passed": true,
  "redaction_rules_version": "1.0.0",
  "license": null,
  "extensions": {}
}
