{
  "_comment": "kb-document 实例；对应 memory/schemas/kb-document.schema.json",
  "id": "doc_88a277cf",
  "source_path": "examples/scn_ticket_summary_zh/kb/sop_vpn_zh.md",
  "source_url": null,
  "title": "VPN 故障排查 SOP（中文）",
  "classification": "internal",
  "content_hash": "sha256:88a277cf857f9fdee36c4b8272b40bdfa121e3a9526956f9f21cc7198f3e456d",
  "version": "1.3.0",
  "ingested_at": "2026-05-01T10:00:00Z",
  "last_modified": "2026-04-28T08:30:00Z",
  "language": "zh-CN",
  "tags": ["vpn", "sop", "L1", "ipsec", "ikev2"],
  "namespace": "opspilot:public-kb",
  "chunk_strategy": "headings_then_size",
  "chunk_count": 3,
  "embedding_model": "ollama-local/nomic-embed-text@2024-02",
  "embedding_dim": 768,
  "redaction_passed": true,
  "redaction_rules_version": "1.0.0",
  "license": null,
  "extensions": {}
}
